Video_name,Visible Actions,Not Visible Actions
9p1_10mini_1.mp4,,make these adorable embellishments right at home all you
9p1_10mini_1.mp4,place it,
9p1_10mini_1.mp4,draw or trace a circle onto your cardboard mine 's about 4 inches in diameter which,
9p1_10mini_1.mp4,,create our pom pom maker
9p1_10mini_1.mp4,make a pretty large pom-pom,
9p1_10mini_1.mp4,,show you how easy it
9p1_10mini_1.mp4,,cutting it out until you
9p1_10mini_1.mp4,cut it out on top of your other piece of cardboard,
9p1_10mini_1.mp4,,looks like this you
9p1_10mini_1.mp4,using some sharp scissors then,
5p0_1mini_2.mp4,,disgusting I
5p0_1mini_2.mp4,,add some different things to it
5p0_1mini_2.mp4,,making this morning
5p0_1mini_2.mp4,,get that a lot I
5p0_1mini_2.mp4,,get that reaction a lot
2p0_8mini_12.mp4,,go to the bulk bins
2p0_8mini_12.mp4,,went shopping
2p0_8mini_12.mp4,put cashews on top if you,
2p0_8mini_12.mp4,,make up my way inspiration
2p0_8mini_12.mp4,,see all these things that I
2p0_8mini_12.mp4,,go to bulk bins
2p0_8mini_12.mp4,,pull down the thing
4p1_4mini_10.mp4,pick up a few of those things,
4p1_4mini_10.mp4,,put my
4p1_4mini_10.mp4,,talking about
4p1_4mini_10.mp4,,watch my video from a while ago I
4p1_4mini_10.mp4,,sharing a summer clean
4p1_4mini_10.mp4,,leave that link
4p1_4mini_10.mp4,moving on to our living room as you,
4p1_4mini_10.mp4,,getting new
4p1_4mini_10.mp4,,found them
4p1_4mini_10.mp4,throw pillows on the couch,
4p1_4mini_10.mp4,,check it out if you
4p1_4mini_10.mp4,,stay tuned
4p1_4mini_10.mp4,,throw clothes for
4p1_4mini_10.mp4,,offered me a code for 10 % off for an order of 20 or more
3p1_4mini_4.mp4,,find them at your local Walmart I
3p1_4mini_4.mp4,,works as a fabric softener
3p1_4mini_4.mp4,,put it into any container you
3p1_4mini_4.mp4,,linked in the description box below
3p1_4mini_4.mp4,,add in one to two tablespoons per load
3p1_4mini_4.mp4,,see myself
3p1_4mini_4.mp4,,make sure that everything
3p1_4mini_4.mp4,,buying store-bought detergent
3p1_4mini_4.mp4,,added in you just
3p1_4mini_4.mp4,put this into a glass container you,
3p1_4mini_4.mp4,,leave all the ones that I
3p1_4mini_4.mp4,,last you
3p1_4mini_4.mp4,,going back to
3p1_4mini_4.mp4,,give that a really good
5p0_10mini_4.mp4,,take it inside what
5p0_10mini_4.mp4,got some vegan mozzarella I,
5p0_10mini_4.mp4,,tastes like regular yogurt it
5p0_10mini_4.mp4,,got that
5p0_10mini_4.mp4,,show you what I
5p0_10mini_4.mp4,comes in a big block,
5p0_10mini_4.mp4,,got ta
5p1_5mini_3.mp4,cut up strawberries,
5p1_5mini_3.mp4,watch a little bit of TV,
5p1_5mini_3.mp4,make tea in the evenings,
5p1_5mini_3.mp4,,rename what circular Street fixtures in 1990 manual manholes
5p1_5mini_3.mp4,,knew that one good job you just
5p1_5mini_3.mp4,takes place in the back of a cab,
5p1_5mini_3.mp4,,do that one too you
5p1_5mini_3.mp4,,do that one too manual manholes
5p1_5mini_3.mp4,,spit them out quicker
5p1_5mini_3.mp4,,see I
5p1_5mini_3.mp4,,show that
5p1_5mini_3.mp4,called Cash Cab which,
5p1_5mini_3.mp4,,taking a stand against the city of Sacramento
5p1_5mini_3.mp4,,takes place in the back trivia
9p1_6mini_4.mp4,,making complaint with our butter slime it
9p1_6mini_4.mp4,,store it in an airtight container alright guys we
9p1_6mini_4.mp4,see you next Friday bye guys yes creepy of Calvin,
9p1_6mini_4.mp4,,tell me in the comments below what other kinds of slime you
9p1_6mini_4.mp4,,keeps really well if you
9p1_6mini_4.mp4,,see me
1p0_9mini_10.mp4,,use this method daily shower cleaner even though I
1p0_9mini_10.mp4,cleaning the shower doors now I,
1p0_9mini_10.mp4,,makes it
1p0_9mini_10.mp4,,happen a long time ago
1p0_9mini_10.mp4,clean the glass as often,
1p0_9mini_10.mp4,,use it every day I
1p0_9mini_10.mp4,,use a
1p0_9mini_10.mp4,clean the bathtub,
1p0_9mini_10.mp4,,squeegee every day
1p0_9mini_10.mp4,,cleaned once a week I or I
1p0_9mini_10.mp4,,make it
1p0_9mini_10.mp4,use that with a scrubber,
1p0_9mini_10.mp4,,make that a habit I
1p0_9mini_10.mp4,,use this once a week
7p0_9mini_1.mp4,,get things
7p0_9mini_1.mp4,,motivate you
7p0_9mini_1.mp4,,pick up your mood
7p0_9mini_1.mp4,,watching cleaning videos
7p0_9mini_1.mp4,,do a proper clean of anything
7p0_9mini_1.mp4,,doing some cleaning motivation
7p0_9mini_1.mp4,clean your own homes,
7p0_9mini_1.mp4,,build up
7p0_9mini_1.mp4,,did my office my living room I
7p0_9mini_1.mp4,,get in
7p0_9mini_1.mp4,,doing today
7p0_9mini_1.mp4,,cover in these motivation Monday videos
7p0_9mini_1.mp4,,watch this video you
7p0_9mini_1.mp4,,check that out
2p0_8mini_12.mp4,,use recipes for inspiration
2p0_8mini_12.mp4,,went to Whole Foods
2p0_8mini_12.mp4,,use the bulk bins everyone always
2p0_8mini_12.mp4,,make up my way there all of us green color or maybe some sunflower seeds that
2p0_8mini_12.mp4,,getting the amount you
2p0_8mini_12.mp4,,use pumpkin ski I
5p0_1mini_13.mp4,got some short grain brown rice in a pan with some vegetable stock this,
5p0_1mini_13.mp4,use kosher salt,
5p0_1mini_13.mp4,use my hands dirty spread,
5p0_1mini_13.mp4,,sprouted short brown rice
5p0_1mini_13.mp4,cook risotto,
5p0_1mini_13.mp4,got my oven on convection at 375,
5p0_1mini_13.mp4,,use it
5p0_1mini_13.mp4,use a short grain rice when you,
5p0_1mini_13.mp4,stick that in for about 15 to 20 minutes over here on my stove I,
8p1_10mini_8.mp4,,cut back I
8p1_10mini_8.mp4,,cut back
8p1_10mini_8.mp4,,close honey it
8p1_10mini_8.mp4,,close how many cloves you
8p1_10mini_8.mp4,,barking some serious garlic fire it of all first of all I I
8p1_10mini_8.mp4,,got like a 10 clove habit okay okay I
8p1_10mini_8.mp4,,sit next to you
1p1_9mini_3.mp4,,put a flower in there next I
1p1_9mini_3.mp4,,leave them the lighter color
1p1_9mini_3.mp4,,made you
1p1_9mini_3.mp4,,getting rid of in the move
1p1_9mini_3.mp4,,paint onto glass jars bottles I
1p1_9mini_3.mp4,,seal it
1p1_9mini_3.mp4,stain them front,
1p1_9mini_3.mp4,,change them up
1p1_9mini_3.mp4,,see through it
1p1_9mini_3.mp4,,go ahead
1p1_9mini_3.mp4,,go for that more rustic feel
1p1_9mini_3.mp4,making some really easy DIY wood coasters now if you,
1p1_9mini_3.mp4,,show you throughout the video how I
1p1_9mini_3.mp4,,found this wood for a few bucks at Michaels
1p1_9mini_3.mp4,,stain them sirens in the background gardening
1p1_9mini_3.mp4,,gives it that kind of rustic feel I
1p1_9mini_3.mp4,stain these with the wood if you,
1p1_9mini_3.mp4,,stain you
6p0_5mini_7.mp4,,done this before it
6p0_5mini_7.mp4,,drinking a black
6p0_5mini_7.mp4,,cooked when you
6p0_5mini_7.mp4,sit down,
6p0_5mini_7.mp4,add 1 TSP of cold-pressed olive oil,
6p0_5mini_7.mp4,break down the phytates in the kale just,
6p0_5mini_7.mp4,rub the olive oil into the kale this actually,
6p0_5mini_7.mp4,,make sure that you
6p0_5mini_7.mp4,,take a few minutes
6p0_5mini_7.mp4,,seem like a strange thing
6p0_5mini_7.mp4,,keep me
6p0_5mini_7.mp4,,going to massage the kale if you
6p0_5mini_7.mp4,,energized I
6p0_5mini_7.mp4,add some healthy fats to my salad,
3p1_8mini_9.mp4,,follow me on Instagram
3p1_8mini_9.mp4,,see you in my next one
9p1_9mini_1.mp4,,dry the body of our spinner
9p1_9mini_1.mp4,,fidget spinner that you
9p1_9mini_1.mp4,,use v600 or wood glue it
9p1_9mini_1.mp4,punch through,
9p1_9mini_1.mp4,,secure with hot boys
9p1_9mini_1.mp4,,make sure that they
9p1_9mini_1.mp4,,make their own after quite a bit of
9p1_9mini_1.mp4,,cutting our popsicle
9p1_9mini_1.mp4,,take a little longer
9p1_9mini_1.mp4,line up your holes,
9p1_9mini_1.mp4,adjust this slightly for smaller or larger hands,
9p1_9mini_1.mp4,,start by
9p1_9mini_1.mp4,,adjust the pieces until they you
9p1_9mini_1.mp4,,punch a hole on the inside of each piece with our crocodile if you
8p1_10mini_8.mp4,,do it anymore first
8p1_10mini_8.mp4,,made my choice guys I
8p1_10mini_8.mp4,,hold you
8p1_10mini_8.mp4,,quit at any time secondly
8p1_10mini_8.mp4,,come to the point where I
8p1_10mini_8.mp4,,give you an ultimatum it
8p1_10mini_8.mp4,give it up a lemon cashews brown rice fettuccine,
3p0_2mini_14.mp4,take these top pieces,
3p0_2mini_14.mp4,,done with that you
3p0_2mini_14.mp4,,holds yeah
3p0_2mini_14.mp4,tease some of it,
3p0_2mini_14.mp4,go with the comb towards your head once you,
3p0_2mini_14.mp4,twist it a bit,
3p0_2mini_14.mp4,take a comb,
3p0_2mini_14.mp4,take this Kendra volume spray super,
3p0_2mini_14.mp4,,take those
3p0_2mini_14.mp4,put it in an X formation,
3p0_2mini_14.mp4,slip it,
3p0_2mini_14.mp4,take it,
3p0_2mini_14.mp4,look the way you,
3p0_2mini_14.mp4,make it,
9p0_6mini_2.mp4,,putting it into these bottles it very pure
9p0_6mini_2.mp4,put five drops of each oil in there,
9p0_6mini_2.mp4,,keep that man happy the other thing you
9p0_6mini_2.mp4,,smell right now then Noah
9p0_6mini_2.mp4,,has cloves yes definitely
9p0_6mini_2.mp4,,fill it up
9p0_6mini_2.mp4,combine all four of these oils you,
7p1_7mini_2.mp4,,look finish you
7p1_7mini_2.mp4,,Anne I
7p1_7mini_2.mp4,,trust me
7p1_7mini_2.mp4,,use this solar walnuts
7p1_7mini_2.mp4,,show you
7p1_7mini_2.mp4,,pour over the rest of your ingredients with anything
7p1_7mini_2.mp4,,get better
7p1_7mini_2.mp4,,setting it
7p1_7mini_2.mp4,,look like you also
7p1_7mini_2.mp4,,bake at 350 degrees for about 18 minutes
7p1_7mini_2.mp4,,keep in the fridge for a week
7p1_7mini_2.mp4,,dried fruit
7p1_7mini_2.mp4,,mmm next we
7p1_7mini_2.mp4,put in a ziploc bags in,
4p0_4mini_2.mp4,thrown on some gray sweatpants,
4p0_4mini_2.mp4,,get the chance
4p0_4mini_2.mp4,,drink it black
4p0_4mini_2.mp4,get into something a little bit more snuggly I,
4p0_4mini_2.mp4,,end up
4p0_4mini_2.mp4,,decided such a classic I never
4p0_4mini_2.mp4,watch a movie cuz you,
4p0_4mini_2.mp4,got my laptop I,
4p0_4mini_2.mp4,,do you
4p0_4mini_2.mp4,,wearing they `
4p0_4mini_2.mp4,get up out of bed,
4p0_4mini_2.mp4,watch clueless this morning which,
4p0_4mini_2.mp4,snuggle in bed all morning whenever I,
4p0_4mini_2.mp4,snuggling under the blanket it,
9p0_6mini_2.mp4,,fractionated coconut oil or almond oil anything like that
9p0_6mini_2.mp4,,detox the body on guard which I very strong with clove it
9p0_6mini_2.mp4,roll it once or twice on the bottom of these,
9p0_6mini_2.mp4,,got orange cinnamon it
9p0_6mini_2.mp4,,create it in a roller bottle here
9p0_6mini_2.mp4,,taking out just that oil
9p0_6mini_2.mp4,,create it in four of these oils you
7p1_4mini_3.mp4,,work too much this
7p1_4mini_3.mp4,,bottle name it okay there
7p1_4mini_3.mp4,,make sweet candy corn all you
7p1_4mini_3.mp4,,vary it up a bit you
4p1_2mini_6.mp4,,scent it
4p1_2mini_6.mp4,,lasts forever you guys
4p1_2mini_6.mp4,put away the dishes,
4p1_2mini_6.mp4,,makes such a difference we
4p1_2mini_6.mp4,,try it out it that I
4p1_2mini_6.mp4,,using today
4p1_2mini_6.mp4,,mix it with water
4p1_2mini_6.mp4,,put back on my dishwasher
4p1_2mini_6.mp4,get my dragon towel,
4p1_2mini_6.mp4,,use it constantly
5p0_7mini_9.mp4,work on dinner we,
5p0_7mini_9.mp4,get crispy on all the sides,
5p0_7mini_9.mp4,make a salad,
5p0_7mini_9.mp4,,defeat one
5p0_7mini_9.mp4,put them on this grate,
5p0_7mini_9.mp4,add some of the greens that I,
5p0_7mini_9.mp4,,snacking on those
8p1_9mini_4.mp4,,make you just
8p1_9mini_4.mp4,,use fresh or frozen strawberries whatever you
8p1_9mini_4.mp4,,blend that all together once that
8p1_9mini_4.mp4,pour your mixture you,
8p1_9mini_4.mp4,,makes your whole house smell amazing I
8p1_9mini_4.mp4,,packed with omega-3 omega-6 they
8p1_9mini_4.mp4,put about half a cup of chia seeds in your container,
8p1_9mini_4.mp4,stir this all,
8p1_9mini_4.mp4,commingle in there,
8p1_9mini_4.mp4,add one cup of filtered water two cups of apple,
8p1_9mini_4.mp4,try this super easy banana,
7p0_9mini_3.mp4,got really bored one day,
7p0_9mini_3.mp4,changed around I,
7p0_9mini_3.mp4,looking at right now,
7p0_9mini_3.mp4,faces the window,
7p0_9mini_3.mp4,,separate like the dining room
7p0_9mini_3.mp4,,has kind of
7p0_9mini_3.mp4,,see a room like a living room tour or something cuz I kind of really like how cute it
7p0_9mini_3.mp4,,moved my couch the other week I just
7p0_9mini_3.mp4,,set up
7p0_9mini_3.mp4,,leave a comment down below
7p0_9mini_3.mp4,,noticed that my living room
7p0_9mini_3.mp4,,do a living room tour or something
7p0_9mini_3.mp4,,rearrange all my furniture
6p0_5mini_3.mp4,,lose weight I still
6p0_5mini_3.mp4,,get a hungry day
6p0_5mini_3.mp4,,stopping yourself from
6p0_5mini_3.mp4,,eat everything inside I
6p0_5mini_3.mp4,,eat good healthy food
6p0_5mini_3.mp4,,eating the right foods
6p0_5mini_3.mp4,,go through this day
6p0_5mini_3.mp4,,dealing with it every day
6p0_5mini_3.mp4,,deal with it
6p0_5mini_3.mp4,,do okay
6p0_5mini_3.mp4,,get those hungry days for a reason
6p0_5mini_3.mp4,,creating certain nutrient so I
6p0_5mini_3.mp4,,give you your body what it
6p0_5mini_3.mp4,,keep you full they
1p1_5mini_2.mp4,cutting them with my miter,
1p1_5mini_2.mp4,,helping me with this project cuz this
1p1_5mini_2.mp4,,make one of these
1p1_5mini_2.mp4,,cut already from Home Depot this
1p1_5mini_2.mp4,,cut for me at Home Depot
1p1_5mini_2.mp4,,done this on my own I
1p1_5mini_2.mp4,drilled into the larger pieces of wood then we,
6p0_7mini_4.mp4,,eat it out of the jar
6p0_7mini_4.mp4,adding two teaspoons of chia seeds again,
6p0_7mini_4.mp4,,works perfectly
6p0_7mini_4.mp4,,add the extranet
6p0_7mini_4.mp4,add to a jar,
6p0_7mini_4.mp4,,measured that I
6p0_7mini_4.mp4,,use unsweetened almond milk or another milk instead of water for any of these recipes if you
6p0_7mini_4.mp4,,gives it
6p0_7mini_4.mp4,,looks really pretty too
6p0_7mini_4.mp4,,put the oil into a separate bowl you with the spoon next we
6p0_7mini_4.mp4,,mix it all together you
6p0_7mini_4.mp4,,got nuts mixed in
6p0_7mini_4.mp4,,raised in urban
6p0_7mini_4.mp4,,add oats this
1p1_4mini_6.mp4,,making a DIY dog toy this
1p1_4mini_6.mp4,,cut that off
1p1_4mini_6.mp4,,tell I
1p1_4mini_6.mp4,,go I
1p1_4mini_6.mp4,put a hole all the way through it,
1p1_4mini_6.mp4,,borrow my husband 's kitchen tweezers
1p1_4mini_6.mp4,cut the top,
1p1_4mini_6.mp4,insert them through both holes,
1p1_4mini_6.mp4,using this old shirt here,
1p1_4mini_6.mp4,,taking one of Ozzy 's tennis balls
1p1_4mini_6.mp4,,take the strip 's
1p1_4mini_6.mp4,,find at the pet shop basically all you
1p1_4mini_6.mp4,,cut those pieces into strips I
1p1_4mini_6.mp4,,come out on each side I
4p1_4mini_14.mp4,,makes it really nice
4p1_4mini_14.mp4,mop the floors,
4p1_4mini_14.mp4,,go ahead
9p0_9mini_2.mp4,going to fry,
9p0_9mini_2.mp4,,left over in my fridge which
9p0_9mini_2.mp4,,stir all right now a
9p0_9mini_2.mp4,,smell it
9p0_9mini_2.mp4,use a pair of scissors,
9p0_9mini_2.mp4,,turn a nice golden brown which
9p0_9mini_2.mp4,,do that for the pasta
9p0_9mini_2.mp4,,goes right in here
9p0_9mini_2.mp4,,turn a nice sage
9p0_9mini_2.mp4,,using it otherwise
9p0_9mini_2.mp4,,chopped them it
9p0_9mini_2.mp4,,do just
9p0_9mini_2.mp4,,made a butternut squash soup back in the day that
9p0_9mini_2.mp4,,adding some chicken broth now I
9p0_9mini_2.mp4,,smells like nothing else in the world I
9p0_9mini_2.mp4,,sprinkle of salt
1p1_5mini_2.mp4,get long pieces of wood,
1p1_5mini_2.mp4,,see here
1p1_5mini_2.mp4,,went back
1p1_5mini_2.mp4,drilling the screws into the four corners as you,
1p1_5mini_2.mp4,cutting the wood pieces now,
1p1_5mini_2.mp4,cutting here however,
1p1_5mini_2.mp4,,started by the large wood pieces I
9p1_7mini_2.mp4,make your play-doh a lot less sticky,
9p1_7mini_2.mp4,,did a really fun video on homemade playdough a couple years ago
9p1_7mini_2.mp4,,incorporated this part
9p1_7mini_2.mp4,,prefer finely ground as opposed to coarse
9p1_7mini_2.mp4,,take a few minutes
9p1_7mini_2.mp4,add a few scores of liquid glycerin this,
9p1_7mini_2.mp4,,involve any cooking all right we
9p1_7mini_2.mp4,,tada our Sando
9p1_7mini_2.mp4,,do it the spatula or just with your fingers until all the sand
9p1_7mini_2.mp4,,play with
8p1_10mini_6.mp4,lay out your cleaned asparagus onto a piece of foil top that with your fresh salmon note I,
8p1_10mini_6.mp4,,add extra virgin olive oil here as well on top of that we
8p1_10mini_6.mp4,touching the salmon then,
8p1_10mini_6.mp4,,pop it in the oven at 400 degrees for 15 to 25 minutes depending on the size of your salmon then all you
8p1_10mini_6.mp4,add some fresh slices of lemon that,
8p1_10mini_6.mp4,,pop it in the oven at 400 present
8p1_10mini_6.mp4,,make really healthy for you
4p0_7mini_14.mp4,,thank you
4p0_7mini_14.mp4,,watching I
4p0_7mini_14.mp4,,head to wherever I
4p0_7mini_14.mp4,,see you guys again very soon
4p0_7mini_14.mp4,,going maybe the beach or the pool with my family
4p0_7mini_14.mp4,,give this video a thumbs up if you
4p0_7mini_14.mp4,pack things like sunglasses,
4p0_7mini_14.mp4,,seeing my Christmassy holiday morning routine
4p0_7mini_14.mp4,,hope you guys
4p0_7mini_14.mp4,,make sure you
4p1_8mini_6.mp4,cleaned off I,
4p1_8mini_6.mp4,,makes it
4p1_8mini_6.mp4,,relieve in mind
4p1_8mini_6.mp4,put things away,
4p1_8mini_6.mp4,vacuum at least once a day usually twice a day one,
4p1_8mini_6.mp4,get it nice,
4p1_8mini_6.mp4,,keep them then I
4p1_8mini_6.mp4,vacuuming anymore now that we,
4p1_8mini_6.mp4,tidy it up,
4p1_8mini_6.mp4,,do even I
4p1_8mini_6.mp4,,gotten out of hand
4p1_8mini_6.mp4,vacuuming I,
4p1_8mini_6.mp4,,see okay
4p1_8mini_6.mp4,,has really
8p0_1mini_4.mp4,getting rid of for me outer order,
8p0_1mini_4.mp4,,hold on to
8p0_1mini_4.mp4,,took me less than two hours actually when it
8p0_1mini_4.mp4,,defined our past
8p0_1mini_4.mp4,open your hands,
8p0_1mini_4.mp4,,creates inner calm
8p0_1mini_4.mp4,,focusing on who I
8p0_1mini_4.mp4,,make every time you
8p0_1mini_4.mp4,,walk by it it
8p0_1mini_4.mp4,,prepped zones
8p0_1mini_4.mp4,,spent a lot of time
8p0_1mini_4.mp4,,look at this far
8p0_1mini_4.mp4,,letting go of who I
8p0_1mini_4.mp4,,get it
7p0_1mini_2.mp4,,turned out
7p0_1mini_2.mp4,,stop it
7p0_1mini_2.mp4,remake over everything,
7p0_1mini_2.mp4,,excuse me you
7p0_1mini_2.mp4,,holding up the video um as I
7p0_1mini_2.mp4,,point out here to I
7p0_1mini_2.mp4,make my bed,
7p0_1mini_2.mp4,scratch the side of my bed,
7p0_1mini_2.mp4,,excuse me
7p0_1mini_2.mp4,,make a room
7p0_1mini_2.mp4,,doing can you
7p0_1mini_2.mp4,,made I
7p0_1mini_2.mp4,,going to
7p0_1mini_2.mp4,start again,
8p1_10mini_6.mp4,wrap this all up like a little present,
8p1_10mini_6.mp4,,take it out of the oven
8p1_10mini_6.mp4,,add a little bit of butter you
8p1_10mini_6.mp4,,wash my hands after
8p1_10mini_6.mp4,,gives it a nice citrusy flavor
8p1_10mini_6.mp4,unwrap it,
8p1_10mini_6.mp4,add your seasoning whatever you like I just like simple salt,
8p0_7mini_3.mp4,,use the hose dust off of them
8p0_7mini_3.mp4,,vacuum them definitely
8p0_7mini_3.mp4,,whip back on the bed
8p0_7mini_3.mp4,,gives you an opportunity
8p0_7mini_3.mp4,,get all the dust off of them
8p0_7mini_3.mp4,,washing window treatments
8p0_7mini_3.mp4,,moving on to the entryway entryways
8p0_7mini_3.mp4,,give this a try in any room of your house once the linens
8p0_7mini_3.mp4,,moving the furniture it
8p0_7mini_3.mp4,,felts so
8p0_7mini_3.mp4,,collect a lot of dust
8p0_7mini_3.mp4,use the hose extension,
8p0_7mini_3.mp4,,put together
8p0_7mini_3.mp4,,dusted up there when I
4p1_4mini_17.mp4,,got some cleaning motivation from it
4p1_4mini_17.mp4,,hope you guys
4p1_4mini_17.mp4,,follow me over on Instagram as well
4p1_4mini_17.mp4,,see you in my next one
4p1_4mini_17.mp4,,hope you
9p0_1mini_2.mp4,touch it lightly,
9p0_1mini_2.mp4,,make sure okay right there 's
9p0_1mini_2.mp4,blend it until it,
9p0_1mini_2.mp4,lined them with a little bit of parchment paper,
9p0_1mini_2.mp4,,come in for oven they
9p0_1mini_2.mp4,,do now
9p0_1mini_2.mp4,,preheated to 225 degrees I
9p0_1mini_2.mp4,,tell just by
9p0_1mini_2.mp4,spread it until it,
9p0_1mini_2.mp4,,look gig okay
9p0_1mini_2.mp4,taken some baking sheet,
9p0_1mini_2.mp4,touching them,
9p0_1mini_2.mp4,lift just like this,
9p0_1mini_2.mp4,cut them into nice strips,
3p0_2mini_2.mp4,,doing foundation first
3p0_2mini_2.mp4,go back with the P Ranade eyeshadows,
3p0_2mini_2.mp4,,use as a transition color right here
3p0_2mini_2.mp4,,wiping away all my foundation
3p0_2mini_2.mp4,,wipe it away instead of okay
3p0_2mini_2.mp4,use this like light brown,
3p0_2mini_2.mp4,put this on my brow bone,
3p0_2mini_2.mp4,making like a tiny little triangle on the outer third of my eye,
3p0_2mini_2.mp4,,called clouded I
3p0_2mini_2.mp4,use this champagne gold color,
3p0_2mini_2.mp4,use this color which,
3p0_2mini_2.mp4,,use this Sigma e30 brush Applause the reason why I
3p0_2mini_2.mp4,,using this Joe fresh brush that
3p0_2mini_2.mp4,,looks like that
8p0_8mini_2.mp4,,come downstairs
8p0_8mini_2.mp4,take all of the dirty stuff,
8p0_8mini_2.mp4,,start the next day
8p0_8mini_2.mp4,clean up just the living room the way that I,
8p0_8mini_2.mp4,,go around
8p0_8mini_2.mp4,do the laundry clean up all the,
8p0_8mini_2.mp4,,go into
8p0_8mini_2.mp4,put away those miscellaneous things,
8p0_8mini_2.mp4,kick this all over to the laundry,
8p0_8mini_2.mp4,go upstairs in art service I,
8p0_8mini_2.mp4,do the laundry clean up all the toothbrushes once the boys,
8p0_8mini_2.mp4,,makes it really easy
8p0_8mini_2.mp4,,stick items that
8p0_8mini_2.mp4,,work it
5p0_4mini_18.mp4,,do if you
5p0_4mini_18.mp4,,see you next week for another video bye
5p0_4mini_18.mp4,,hope you guys
5p0_4mini_18.mp4,,keep it the same
5p0_4mini_18.mp4,,make my tea you
5p0_4mini_18.mp4,,change your diet
5p0_4mini_18.mp4,,watching if you
5p0_4mini_18.mp4,,do you
5p0_4mini_18.mp4,,comment if you
5p0_4mini_18.mp4,,supports my channel
5p0_4mini_18.mp4,,see how I
5p0_4mini_18.mp4,,check out my nighttime routine I really please
5p0_4mini_18.mp4,,solve my need for something sweet at the end of the day
2p0_9mini_5.mp4,added a little bit of vanilla extract,
2p0_9mini_5.mp4,add it to a bowl,
2p0_9mini_5.mp4,,added a little bit more rice milk just
2p0_9mini_5.mp4,,gets nice next just
2p0_9mini_5.mp4,add your spirulina powder,
2p0_9mini_5.mp4,,makes it a little special
2p0_9mini_5.mp4,,put on our toppings I
2p0_9mini_5.mp4,,hemp seeds
2p0_9mini_5.mp4,sprinkled on some of those green hemp seeds,
2p0_9mini_5.mp4,,threes some other great green toppings
2p0_9mini_5.mp4,,grab the jar
2p0_9mini_5.mp4,,see I
2p0_9mini_5.mp4,add this tiny little bit about a 1/2 teaspoon I,
2p0_9mini_5.mp4,,taking my breakfast
4p0_6mini_6.mp4,wearing a little white t-shirt with this little necklace little gold necklace,
4p0_6mini_6.mp4,wearing these just quite simple blue ripped jeans these,
4p0_6mini_6.mp4,,called mr. price in South Africa there
4p0_6mini_6.mp4,,gets colder I
4p0_6mini_6.mp4,,changed into my little outfit of the day I
4p0_6mini_6.mp4,,show you guys what I
4p0_6mini_6.mp4,,wearing I
1p1_8mini_5.mp4,,shelving now
1p1_8mini_5.mp4,,got four of the galvanized floor flanges
1p1_8mini_5.mp4,,gon into detail on this
1p1_8mini_5.mp4,,got 4 total I
1p1_8mini_5.mp4,,made sure to mark where I
1p1_8mini_5.mp4,,finding a stud I
1p1_8mini_5.mp4,,hold the wood
7p0_10mini_2.mp4,sped up cleaning videos I,
7p0_10mini_2.mp4,,fighting the dark
7p0_10mini_2.mp4,,falling down on my knees up in
7p0_10mini_2.mp4,put back into its rightful place,
7p0_10mini_2.mp4,,hear me tonight I just
7p0_10mini_2.mp4,,get into
7p0_10mini_2.mp4,,make sense of it all I just
7p0_10mini_2.mp4,,drifting away far away in the deepest of C 's the world
7p0_10mini_2.mp4,,watching these
7p0_10mini_2.mp4,,watch an entire room just
7p0_10mini_2.mp4,,cleaning my entire pallet can you
7p0_10mini_2.mp4,,satisfying about
7p0_10mini_2.mp4,,hope you
1p1_2mini_3.mp4,,used up to six to eight times before you
1p1_2mini_3.mp4,reduce static,
1p1_2mini_3.mp4,use these with a laundry booster,
1p1_2mini_3.mp4,refreshing your carpet next I,
1p1_2mini_3.mp4,thrown into the wash in place of regular laundry detergent,
1p1_2mini_3.mp4,,buy in the store
1p1_2mini_3.mp4,use lemon or orange,
1p1_2mini_3.mp4,,replace basically your laundry detergent with those
1p1_2mini_3.mp4,,use it up to six to eight times the other thing
1p1_2mini_3.mp4,,discard them it
1p1_2mini_3.mp4,share a few natural laundry alternatives starting with soap nuts in a muslin bag now these,
1p1_2mini_3.mp4,decrease the drying time in general it,
1p1_2mini_3.mp4,,work for
2p1_1mini_2.mp4,make sure,
2p1_1mini_2.mp4,leave a like on his video,
2p1_1mini_2.mp4,give it a like,
2p1_1mini_2.mp4,,gon to Sadie I
2p1_1mini_2.mp4,doing a collab with JT,
2p1_1mini_2.mp4,,grew enough for me
2p1_1mini_2.mp4,head over to his channel,
2p1_1mini_2.mp4,,sent you I
2p1_1mini_2.mp4,,comment in his comments that I
2p1_1mini_2.mp4,did a collab with that,
2p1_1mini_2.mp4,,doing a school morning routine for 2017
2p1_1mini_2.mp4,,click in the I
2p1_1mini_2.mp4,,see my school morning routine then
2p1_1mini_2.mp4,collab with someone,
7p0_10mini_5.mp4,see everything that I,
7p0_10mini_5.mp4,,stand still
7p0_10mini_5.mp4,,done today I
7p0_10mini_5.mp4,leave a comment down I,
7p0_10mini_5.mp4,leave a comment down below,
7p0_10mini_5.mp4,pick up,
7p0_10mini_5.mp4,,tell you what I
7p0_10mini_5.mp4,,do a little bit more tomorrow yeah I
7p0_10mini_5.mp4,,doing voiceover
7p0_10mini_5.mp4,,doing I
7p0_10mini_5.mp4,,stay Stan Stan when ash Oh
1p1_7mini_3.mp4,add my essential oil mix for this one I,
1p1_7mini_3.mp4,fill the rest with water,
1p1_7mini_3.mp4,mixing this together,
1p1_7mini_3.mp4,adding 1 tablespoon of vegetable glycerin,
1p1_7mini_3.mp4,,comes time to
