Video_name,Visible Actions,Not Visible Actions
6p0_2mini_11.mp4,,wear sweet potatoes like this for about 20 to 40 minutes at about 180 degrees Celsius which
6p0_2mini_11.mp4,,cook it with 1/2 to 1 teaspoon of oil a little black pepper sea salt
2p0_8mini_16.mp4,,watching I
2p0_8mini_16.mp4,,hope this
2p0_8mini_16.mp4,,using kalamata olives
2p0_8mini_16.mp4,,thank you guys for
2p0_8mini_16.mp4,,ate this whole bowl ready
2p0_8mini_16.mp4,,done in 30 minutes
2p0_8mini_16.mp4,,do shoes
2p0_8mini_16.mp4,,took me 45 minutes
2p0_8mini_16.mp4,,gotten it
2p0_8mini_16.mp4,,has an optional note in there that you
2p0_8mini_16.mp4,,add cherry tomatoes
2p0_8mini_16.mp4,,look all olives
2p0_8mini_16.mp4,,get this all together it probably
5p1_1mini_2.mp4,,recommend after that I
5p1_1mini_2.mp4,using a satin pillowcase,
5p1_1mini_2.mp4,get up,
5p1_1mini_2.mp4,waking up naturally with the daylight,
5p1_1mini_2.mp4,,helps just
5p1_1mini_2.mp4,,make every morning
5p1_1mini_2.mp4,keep my second day curls intact,
9p0_2mini_1.mp4,,make sure
9p0_2mini_1.mp4,add my vegetables,
9p0_2mini_1.mp4,make mac,
9p0_2mini_1.mp4,,has vegetables
9p0_2mini_1.mp4,,hidden inside of it
9p0_2mini_1.mp4,boiling in my steamer I,
9p0_2mini_1.mp4,,go through our greedy ins you
9p0_2mini_1.mp4,,got water
9p0_2mini_1.mp4,,finding ways
9p0_2mini_1.mp4,add 3/4 cup of water to a blender,
9p0_2mini_1.mp4,,make life with kids easier in the kitchen
9p0_2mini_1.mp4,,make it on the show a couple years ago
9p0_2mini_1.mp4,puree them I,
9p0_2mini_1.mp4,,share with you guys my favorite mac
10p0_10mini_3.mp4,add in cilantro green onion red onion red pepper,
10p0_10mini_3.mp4,,go that extra step further I
10p0_10mini_3.mp4,,posted this
10p0_10mini_3.mp4,drizzle it all over,
10p0_10mini_3.mp4,Give it a good shake,
10p0_10mini_3.mp4,Toss everything together until everything,
10p0_10mini_3.mp4,,'cause I
10p0_10mini_3.mp4,,slice some very ripe avocado and just place that
10p0_10mini_3.mp4,topped it with some pomegranate seeds just,
10p0_10mini_3.mp4,using my creamy lemon ginger salad,
10p0_10mini_3.mp4,chop it up as well,
10p0_10mini_3.mp4,,dressing in last week 's video
10p0_10mini_3.mp4,,looked cute with the shredded kale
10p0_10mini_3.mp4,,find the avocado with the crunchy veggies
6p0_6mini_5.mp4,,make I
6p0_6mini_5.mp4,,take that long
6p0_6mini_5.mp4,,eat really quickly then I
6p0_6mini_5.mp4,pitted for olives then my favorite salad,
6p0_6mini_5.mp4,dressing recipe a squeeze of fresh lemon,
6p0_6mini_5.mp4,,mean that I
6p0_6mini_5.mp4,,give my body a chance
9p0_2mini_2.mp4,add a little bit of milk,
9p0_2mini_2.mp4,,see there
9p0_2mini_2.mp4,followed by my cream cheese,
9p0_2mini_2.mp4,,give it one more quick
9p0_2mini_2.mp4,,got my helper for the best part which
9p0_2mini_2.mp4,use a whisk,
9p0_2mini_2.mp4,make our sauce,
9p0_2mini_2.mp4,add some salt to the sauce,
9p0_2mini_2.mp4,,looks like when I now I
9p0_2mini_2.mp4,make it smoother,
9p0_2mini_2.mp4,,hiding in our mac
9p0_2mini_2.mp4,,scoop in next I
9p0_2mini_2.mp4,,cooked you
9p0_2mini_2.mp4,,prepped you
9p0_2mini_2.mp4,smell great,
9p0_2mini_2.mp4,melted if you finally,
5p1_1mini_2.mp4,,sleeping on a satin pillowcase
5p1_1mini_2.mp4,,puts me in a better mood right off the bat
5p1_1mini_2.mp4,,looking at my phone I it
5p1_1mini_2.mp4,get me physically out of bed,
5p1_1mini_2.mp4,,stall in the bed
5p1_1mini_2.mp4,,find that just
5p1_1mini_2.mp4,brush out my hair,
4p1_4mini_13.mp4,,use my cordless vacuum
4p1_4mini_13.mp4,,downstairs the last thing I
4p1_4mini_13.mp4,,sprawled across our entire main living area
4p1_4mini_13.mp4,,keep the rest of the house pretty clean
4p1_4mini_13.mp4,,mop everything now usually I
4p1_4mini_13.mp4,,waking up anybody
4p1_4mini_13.mp4,,go ahead
4p1_4mini_13.mp4,,heading back
7p1_8mini_3.mp4,,looks like this
7p1_8mini_3.mp4,,get PC like wait
7p1_8mini_3.mp4,,yeah I
7p1_8mini_3.mp4,,glaze like consistency what
4p1_1mini_9.mp4,,make sure
4p1_1mini_9.mp4,,make our bed
4p1_1mini_9.mp4,,try it out if you
4p1_1mini_9.mp4,,makes the house feel
4p1_1mini_9.mp4,,take the actual
4p1_1mini_9.mp4,,go ahead
4p1_1mini_9.mp4,dusting part off,
4p1_1mini_9.mp4,,finding out it
4p1_1mini_9.mp4,,throw it into the washer
4p1_1mini_9.mp4,,collects the best really well
4p1_1mini_9.mp4,,going for the day
4p1_1mini_9.mp4,,picked up
4p1_1mini_9.mp4,moving on to the bedroom I just,
4p1_1mini_9.mp4,,coming into our room
5p0_4mini_14.mp4,add a big scoop of salsa to the cheesy sauce,
5p0_4mini_14.mp4,,looking for
5p0_4mini_14.mp4,putting the sauce on,
5p0_4mini_14.mp4,,release my camera
5p0_4mini_14.mp4,,use some apple cider vinegar
5p0_4mini_14.mp4,,gives it that
5p0_4mini_14.mp4,,filmed myself
5p0_4mini_14.mp4,,making these enchiladas like
5p0_4mini_14.mp4,,making I literally just
5p0_4mini_14.mp4,,putting the
5p0_4mini_14.mp4,,rolling them up
5p0_4mini_14.mp4,,go in with the gold potatoes I
5p0_4mini_14.mp4,,brighten it up
5p0_4mini_14.mp4,,filling in everything
10p1_7mini_2.mp4,,hope you guys
10p1_7mini_2.mp4,rinse them really well underneath the kitchen sink here,
10p1_7mini_2.mp4,put everything,
10p1_7mini_2.mp4,,fall about
10p1_7mini_2.mp4,show you exactly everything you,
10p1_7mini_2.mp4,,get right to it for this recipe you cinnamon some old fashioned oats a container in some unsweetened almond milk
10p1_7mini_2.mp4,,make sure you
10p1_7mini_2.mp4,,taking my first apple
4p0_6mini_10.mp4,keep my probiotic in the fridge it C probiotic robotic that vitamin B it,
4p0_6mini_10.mp4,,string you
4p0_6mini_10.mp4,,go I
4p0_6mini_10.mp4,,get the ones
4p0_6mini_10.mp4,keep in the fridge vitamin B vitamin,
4p0_6mini_10.mp4,,go my snap on my back
4p0_6mini_10.mp4,,taste as now they `
4p0_6mini_10.mp4,,urge it
2p0_4mini_7.mp4,add a half a teaspoon of spirulina powder,
2p0_4mini_7.mp4,score the flesh of the avocado just,
2p0_4mini_7.mp4,mashing it up,
2p0_4mini_7.mp4,use this,
2p0_4mini_7.mp4,,started before I
2p0_4mini_7.mp4,,help myself I
2p0_4mini_7.mp4,prep the other ingredients,
2p0_4mini_7.mp4,,going to just kind of
2p0_4mini_7.mp4,,go in for a bite my third
2p0_4mini_7.mp4,taking the seed out of the avocado then I,
2p0_4mini_7.mp4,take my knife,
2p0_4mini_7.mp4,use your favorite bread I,
2p0_4mini_7.mp4,,put it in the toaster while I
2p0_4mini_7.mp4,,sprouted rye bread from Trader Joe 's
2p0_5mini_10.mp4,chop up an apple,
2p0_5mini_10.mp4,,using a Fuji apple they
2p0_5mini_10.mp4,,used to it
2p0_5mini_10.mp4,make it even more,
2p0_5mini_10.mp4,,used to
2p0_5mini_10.mp4,take the edge off,
2p0_5mini_10.mp4,,dressing I really
2p0_5mini_10.mp4,,recommend maybe if you
2p0_5mini_10.mp4,,eating raw apple cider vinegar cuz it
2p0_5mini_10.mp4,dressing I,
2p0_5mini_10.mp4,,adding like a touch of maple syrup or your sweetener of choice
2p0_5mini_10.mp4,removing the core from them,
2p0_5mini_10.mp4,added some chia seeds just,
2p0_5mini_10.mp4,,add some really great omega-3s
6p0_6mini_8.mp4,adding to the pan,
6p0_6mini_8.mp4,,looking pretty saucy
6p0_6mini_8.mp4,,add a tiny little bit of water to the sauce when it
6p0_6mini_8.mp4,use brown rice pasta spaghetti I always,
6p0_6mini_8.mp4,toss that up quickly with the sauce,
6p0_6mini_8.mp4,,measured up one cup of cooked pasta which I
6p0_6mini_8.mp4,cook that over a medium heat on the stove for a few minutes until it I,
6p0_6mini_8.mp4,,stick together
6p0_6mini_8.mp4,using gluten-free pasta,
6p0_6mini_8.mp4,make some spaghetti I always,
6p0_6mini_8.mp4,cook for about ten minutes,
6p0_6mini_8.mp4,,use brown rice pasta or gluten-free pasta today
6p0_6mini_8.mp4,,add that
6p0_6mini_8.mp4,,drained it
2p0_5mini_11.mp4,,smells amazing with that vegetable broth
2p0_5mini_11.mp4,,see it
2p0_5mini_11.mp4,used a fork,
2p0_5mini_11.mp4,,done they
2p0_5mini_11.mp4,,garnish my lunch every day now my quinoa
2p0_5mini_11.mp4,,looks like this
2p0_5mini_11.mp4,,smelled in credible they
2p0_5mini_11.mp4,,make sure I
2p0_5mini_11.mp4,,make sure that what they
2p0_5mini_11.mp4,,get through it
2p0_5mini_11.mp4,stirred it up,
2p0_5mini_11.mp4,,pierced one
2p0_5mini_11.mp4,chop them into really thin slices,
2p0_5mini_11.mp4,checked them,
7p0_8mini_7.mp4,,watching them
7p0_8mini_7.mp4,tidy my apartment I really,
7p0_8mini_7.mp4,,yeah so
7p0_8mini_7.mp4,,yeah again I
7p0_8mini_7.mp4,,heard this
7p0_8mini_7.mp4,,leave a comment down below
7p0_8mini_7.mp4,,clean my favorite part
7p0_8mini_7.mp4,,done Applause
7p0_8mini_7.mp4,,going around
7p0_8mini_7.mp4,,do in your house to clean
7p0_8mini_7.mp4,,hope you
7p0_8mini_7.mp4,,hope you guys
7p0_8mini_7.mp4,,make one
7p0_8mini_7.mp4,,doing these kinds of videos
1p1_9mini_1.mp4,,has a much more rustic feel which I
1p1_9mini_1.mp4,,doing some more rustic type DIYs
1p1_9mini_1.mp4,,using love spells that
1p1_9mini_1.mp4,,bought a house that
1p1_9mini_1.mp4,,made several basically with just a double boiler
1p1_9mini_1.mp4,add the scent,
1p1_9mini_1.mp4,,chopping up
1p1_9mini_1.mp4,,make some things with that
1p1_9mini_1.mp4,,shown how
1p1_9mini_1.mp4,,make candles before my channel
1p1_9mini_1.mp4,,found in the yard barn
1p1_9mini_1.mp4,,start first with the upcycle candle I
1p1_9mini_1.mp4,decorate it for the fall,
1p1_9mini_1.mp4,,find these at like flea markets second-hand shops usually wood for the fall
4p0_2mini_2.mp4,,prefer mint green tea it
4p0_2mini_2.mp4,,lose weight okay
4p0_2mini_2.mp4,,believe in specific weight loss or skinny peas or fatties a tea alone
4p0_2mini_2.mp4,,has a better taste that
4p0_2mini_2.mp4,,keep I
4p0_2mini_2.mp4,,help me
4p0_2mini_2.mp4,,notice off my day with
4p0_2mini_2.mp4,,makes you
4p0_2mini_2.mp4,,make you
4p0_2mini_2.mp4,,wake up honestly
4p0_2mini_2.mp4,,do this what I also
4p0_2mini_2.mp4,drink this plain I,
4p0_2mini_2.mp4,,make a cup of green tea
4p0_2mini_2.mp4,do regular morning routine things that,
7p1_2mini_3.mp4,,go back to the bakery for a thirty dollar ice cream cake yeah je suis weight
7p1_2mini_3.mp4,,makes it
7p1_2mini_3.mp4,,looks like a hot mess I definitely
7p1_2mini_3.mp4,,look really bad really messy ours
7p1_2mini_3.mp4,,promise you it
7p1_2mini_3.mp4,,fail this
7p1_2mini_3.mp4,added our pink Cool Whip,
7p1_2mini_3.mp4,,turn really bright
7p1_2mini_3.mp4,,promise you
7p1_2mini_3.mp4,adding a bit of gel food,
7p1_2mini_3.mp4,took the heart cake out of the freezer,
7p1_2mini_3.mp4,top it with raspberries this never will you,
7p1_2mini_3.mp4,coloring to the Cool Whip it,
1p1_10mini_3.mp4,,izing myself with this particular one it
1p1_10mini_3.mp4,,comes with nurse pads
1p1_10mini_3.mp4,,put on to the connector like
1p1_10mini_3.mp4,,go on to the valves as you
1p1_10mini_3.mp4,putting the membrane on the valve itself,
1p1_10mini_3.mp4,,comes with two breast shields which this
1p1_10mini_3.mp4,,going ahead
1p1_10mini_3.mp4,,ripped or torn
1p1_10mini_3.mp4,,get that start with a breast pump
1p1_10mini_3.mp4,,comes with connectors which these connectors
1p1_10mini_3.mp4,,goes around the nipple
1p1_10mini_3.mp4,,help itself
1p1_10mini_3.mp4,putting them on to the valve,
1p1_10mini_3.mp4,,comes with two valves
8p0_10mini_2.mp4,,pine cones
8p0_10mini_2.mp4,,go through
8p0_10mini_2.mp4,,fall I
8p0_10mini_2.mp4,,buy all of the Christmas things it
8p0_10mini_2.mp4,,buy some they
8p0_10mini_2.mp4,,tackle the guest room
8p0_10mini_2.mp4,,looking pretty bad Dollar Tree DIY projects
8p0_10mini_2.mp4,,added a few Christmas touches I also this
8p0_10mini_2.mp4,,shove the crap in the closet lousy Christmas snow
8p0_10mini_2.mp4,spraying the bed sheets with natural scented spray,
8p0_10mini_2.mp4,,go to the store
8p0_10mini_2.mp4,,working on projects
8p0_10mini_2.mp4,,make your house feel
8p0_10mini_2.mp4,,come at a price people I
1p0_10mini_1.mp4,,going after I
1p0_10mini_1.mp4,,does grocery shopping
1p0_10mini_1.mp4,,reading a few books
1p0_10mini_1.mp4,making super quick chicken tacos I,
1p0_10mini_1.mp4,cook dinner I usually,
1p0_10mini_1.mp4,,share with you guys my current nighttime routine while I
1p0_10mini_1.mp4,,start every night with dinner now I
1p0_10mini_1.mp4,,cook with whatever we
1p0_10mini_1.mp4,getting my son ready for bed this usually,
1p0_10mini_1.mp4,,jump right in
1p0_10mini_1.mp4,,looks like so I
1p0_10mini_1.mp4,do the dishes,
1p0_10mini_1.mp4,,go ahead
1p0_10mini_1.mp4,,cook more plant-based meals both on my channel
8p1_9mini_9.mp4,,told you it
8p1_9mini_9.mp4,,sticks everybody snacks babe I
8p1_9mini_9.mp4,,see I
7p0_2mini_2.mp4,,means that everything
7p0_2mini_2.mp4,,stay there it that they
7p0_2mini_2.mp4,,keep everything pretty minimal like when I
7p0_2mini_2.mp4,,has a place that it
7p0_2mini_2.mp4,,moved into this room I
7p0_2mini_2.mp4,,clean I just
7p0_2mini_2.mp4,,sharing a place with something else following on from that
1p0_5mini_1.mp4,add a little bit of water it,
1p0_5mini_1.mp4,,figured I
1p0_5mini_1.mp4,,cleansing oil
1p0_5mini_1.mp4,,chat with y' all while I
1p0_5mini_1.mp4,,using right now after I
1p0_5mini_1.mp4,,cleaned it with the sensitive skin facial
1p0_5mini_1.mp4,,cleansing oils I
1p0_5mini_1.mp4,,cleanse my face my face
1p0_5mini_1.mp4,,rose scent to it
1p0_5mini_1.mp4,cleanse my skin with the cleansing oil I just,
1p0_5mini_1.mp4,,do a little facial
1p0_5mini_1.mp4,,ask you guys
1p0_5mini_1.mp4,,watching a show
1p0_5mini_1.mp4,,cleaned my face with
1p0_6mini_1.mp4,,share with you a few things that I
1p0_6mini_1.mp4,,asking what I
1p0_6mini_1.mp4,,doing an updated haircare routine a lot of you
1p0_6mini_1.mp4,,share with you a few thought I
1p0_6mini_1.mp4,,adding the vital proteins marine collagen to my green tea a few months ago
1p0_6mini_1.mp4,,add the two of those together
1p0_6mini_1.mp4,,start first with what I
1p0_6mini_1.mp4,,using for a while I
1p0_6mini_1.mp4,,drink it occasionally I
1p0_6mini_1.mp4,,add some hot water I usually
1p0_6mini_1.mp4,,looks soft
1p0_6mini_1.mp4,,sweeten my tea or anything like that I just
1p0_6mini_1.mp4,,drink it in the morning with my green tea
1p0_6mini_1.mp4,,drink green tea every single morning I
7p0_2mini_2.mp4,,has underwear that no less
7p0_2mini_2.mp4,,rest my cup of tea there
7p0_2mini_2.mp4,,has socks one
8p0_7mini_5.mp4,,stand carpeting
8p0_7mini_5.mp4,,starting with the couches I
8p0_7mini_5.mp4,,get everything off the entryway you it I just
8p0_7mini_5.mp4,take off the cushions,
8p0_7mini_5.mp4,,looking fantastic now
8p0_7mini_5.mp4,,rubbing alcohol
8p0_7mini_5.mp4,,moving on to our upstairs playroom okay
8p0_7mini_5.mp4,,fits exactly on the rubbing alcohol bottle just like the 70 cent one that you
8p0_7mini_5.mp4,cleanse the microfiber,
8p0_7mini_5.mp4,use my hose extension to clean inside of them,
5p1_10mini_5.mp4,,brush my teeth while I
5p1_10mini_5.mp4,wipe down of the countertops,
5p1_10mini_5.mp4,talk about this a lot more detail,
5p1_10mini_5.mp4,,do a quick
5p1_10mini_5.mp4,hop in the shower,
5p1_10mini_5.mp4,jump into my skincare routine,
5p1_10mini_5.mp4,eat my dinner,
1p0_5mini_2.mp4,,tell you what I
1p0_5mini_2.mp4,left in there,
1p0_5mini_2.mp4,,used the fresh sugar face polish which I really like this polish for a physical exfoliant I
1p0_5mini_2.mp4,,has the tag on it
1p0_5mini_2.mp4,,use them when you
1p0_5mini_2.mp4,,use the fresh vitamin nectar vibrancy
1p0_5mini_2.mp4,,use it
1p0_5mini_2.mp4,,boosting face mask this
1p0_5mini_2.mp4,wash it,
1p0_5mini_2.mp4,,talked about before on my channel
1p0_5mini_2.mp4,used a little bit of that you just into your skin,
1p0_5mini_2.mp4,using this,
1p1_4mini_13.mp4,,thank you
1p1_4mini_13.mp4,,thank you we
1p1_4mini_13.mp4,,see you
1p1_4mini_13.mp4,,hit a million subscribers
1p1_4mini_13.mp4,,got something out of it
5p0_1mini_7.mp4,making a protein shake I,
5p0_1mini_7.mp4,,drink more water or both
5p0_1mini_7.mp4,take the opportunity,
5p0_1mini_7.mp4,,started a new program on fitness blenders website
5p0_1mini_7.mp4,blend plant-based protein vanilla with all essential amino acids,
2p0_8mini_13.mp4,,throw a packaging away as much as you normally
2p0_8mini_13.mp4,,assemble at all
2p0_8mini_13.mp4,,buying more cuz
2p0_8mini_13.mp4,,save all this money
2p0_8mini_13.mp4,,get it into the bag
2p0_8mini_13.mp4,getting packaging,
2p0_8mini_13.mp4,,put it back in a little bit I
2p0_8mini_13.mp4,,calls for a half a stick slice of rye bread and I just Joe 's
2p0_8mini_13.mp4,,excited the last thing that I
2p0_8mini_13.mp4,,end up
2p0_8mini_13.mp4,,get too
2p0_8mini_13.mp4,,paying for packaging
2p0_8mini_13.mp4,,do for the salad before I
2p0_8mini_13.mp4,,get way more than they
8p0_5mini_4.mp4,,hope this video
8p0_5mini_4.mp4,do things,
8p0_5mini_4.mp4,,gets on here
8p0_5mini_4.mp4,rinse it off,
8p0_5mini_4.mp4,,trying out a few of these tips
8p0_5mini_4.mp4,,go the extra mile
8p0_5mini_4.mp4,rub it in with any type of one dollar scrub brush or sponge,
8p0_5mini_4.mp4,clean the bathroom we,
8p0_5mini_4.mp4,,tackle a space in your bathroom maybe
8p0_5mini_4.mp4,,look new again we we generally like the
8p0_5mini_4.mp4,,inspired you
8p0_5mini_4.mp4,,make the space
8p0_5mini_4.mp4,,make all the difference laundering towels
8p0_5mini_4.mp4,,faces lots of toothpaste
5p1_10mini_5.mp4,head upstairs,
5p1_10mini_5.mp4,,watching I I I I
5p1_10mini_5.mp4,,apply some lotion
5p1_10mini_5.mp4,,add water to
5p1_10mini_5.mp4,,put together a pregnancy safe mask for me that I
5p1_10mini_5.mp4,,go to bed on the earlier side I
5p1_10mini_5.mp4,,leave that
8p0_9mini_1.mp4,,loving around Christmastime oatmeal brown sugar
8p0_9mini_1.mp4,keep my routine really simple,
8p0_9mini_1.mp4,,keeping it real first I
8p0_9mini_1.mp4,,eat with the boys this
8p0_9mini_1.mp4,,got this from a friend at a holiday gift exchange next we
8p0_9mini_1.mp4,,do it on a dime with Katherine today
8p0_9mini_1.mp4,,jump in the shower I
8p0_9mini_1.mp4,,do this in under 10 minutes I
8p0_9mini_1.mp4,,sharing with you our one-hour morning routine everything I
8p0_9mini_1.mp4,,do in the first hour
6p0_2mini_13.mp4,,serve pretty tasty
6p0_2mini_13.mp4,,lose weight
6p0_2mini_13.mp4,,eat in a day
6p0_2mini_13.mp4,,eating the dinner
6p0_2mini_13.mp4,,relax for a few minutes while I I I generally I then
6p0_2mini_13.mp4,,eat 1100 to 1400 calories a day
6p0_2mini_13.mp4,,lose weight depending on how active
4p1_5mini_10.mp4,,got a little bit of any motivation as well
4p1_5mini_10.mp4,,coming along with me during my Monday cleaning of my master bathroom
4p1_5mini_10.mp4,,follow me over on Instagram
4p1_5mini_10.mp4,,see you in my next one
4p1_5mini_10.mp4,,hope you
6p0_10mini_7.mp4,,eat more than I actually
6p0_10mini_7.mp4,,added sea salt at the beginning when I
6p0_10mini_7.mp4,eat my meals,
6p0_10mini_7.mp4,add any more I,
6p0_10mini_7.mp4,sit down for a few minutes when I,
6p0_10mini_7.mp4,sit down,
6p0_10mini_7.mp4,,grew up drinking it every day it
6p0_10mini_7.mp4,,done eating which
6p0_10mini_7.mp4,,mean that I
6p0_10mini_7.mp4,,eat slowly
6p0_10mini_7.mp4,,digest it if I
6p0_10mini_7.mp4,,eat it really quickly then I
6p0_10mini_7.mp4,drink it,
6p0_10mini_7.mp4,,done eating
4p1_2mini_9.mp4,,wipe it down with the equal afterwards
4p1_2mini_9.mp4,covered with a little bit of water,
4p1_2mini_9.mp4,using water,
4p1_2mini_9.mp4,rinse that same rag out with water,
4p1_2mini_9.mp4,saw clean I,
4p1_2mini_9.mp4,polishes your stainless steel,
4p1_2mini_9.mp4,,grab my 8 o'clock
1p0_5mini_5.mp4,,came out with Isaiah
1p0_5mini_5.mp4,,keep them alive I still
1p0_5mini_5.mp4,,get a good workout in then a manicure pedicure
1p0_5mini_5.mp4,,cares that the ones he
1p0_5mini_5.mp4,,balancing that between the two of us
1p0_5mini_5.mp4,,fit he
1p0_5mini_5.mp4,,rely on me
1p0_5mini_5.mp4,,see what her name
1p0_5mini_5.mp4,,prioritize that
1p0_5mini_5.mp4,,gotten a manicure pedicure in a really long time
1p0_5mini_5.mp4,,getting stronger
1p0_5mini_5.mp4,,fit like perfect
1p0_5mini_5.mp4,,cut significantly
1p0_5mini_5.mp4,,getting a sweat
2p0_4mini_3.mp4,mix it up,
2p0_4mini_3.mp4,take the saucepan over to the stove,
2p0_4mini_3.mp4,,making sure
2p0_4mini_3.mp4,adding that in there,
2p0_4mini_3.mp4,,add it to your nut
2p0_4mini_3.mp4,add about a teaspoon of pure vanilla extract,
2p0_4mini_3.mp4,,using maple syrup for its smoky sweet flavor
2p0_4mini_3.mp4,whisk it all together once it,
2p0_4mini_3.mp4,,measuring cup
2p0_4mini_3.mp4,,get every last a little bit out of that
2p0_4mini_3.mp4,,added to it
2p0_4mini_3.mp4,put it over a medium low heat until the peanut butter,
2p0_4mini_3.mp4,,dissolved into the liquids
2p0_4mini_3.mp4,,buy organic peanut butter that
6p0_2mini_13.mp4,,make sure that I
6p0_2mini_13.mp4,,make them there that I
6p0_2mini_13.mp4,put the full recipes with a calorie breakdown for everything that I,
6p0_2mini_13.mp4,,watching Netflix or something or maybe one of my favorite YouTube channels
6p0_2mini_13.mp4,ate today over on the blog for you,
6p0_2mini_13.mp4,,lose weight in a healthy way the calories that you
6p0_2mini_13.mp4,,make Buddha
8p1_10mini_9.mp4,,smooth now if you
8p1_10mini_9.mp4,prepare my pasta you probably,
8p1_10mini_9.mp4,make it even creamier,
8p1_10mini_9.mp4,start with about two cups of cashews,
8p1_10mini_9.mp4,,add a little bit of butter or even milk
8p1_10mini_9.mp4,make pasta unless you,
8p1_10mini_9.mp4,adding only two cloves,
8p1_10mini_9.mp4,,set some aside
8p1_10mini_9.mp4,,last me for about a week
8p1_10mini_9.mp4,blend everything up until it,
8p1_10mini_9.mp4,put your pasta,
8p1_10mini_9.mp4,add in the juice of half of a lemon then,
8p1_10mini_9.mp4,add our garlic I,
8p1_10mini_9.mp4,,taste even better you
6p0_9mini_2.mp4,makes the smoothie really creamy,
6p0_9mini_2.mp4,,taste it in the smoothie
6p0_9mini_2.mp4,add one flat tablespoon of unsweetened almond butter that I,
6p0_9mini_2.mp4,add a pinch of cinnamon,
6p0_9mini_2.mp4,add the main ingredient with blueberries,
6p0_9mini_2.mp4,,adds healthy fats which
6p0_9mini_2.mp4,add one set of an avocado you,
4p1_2mini_9.mp4,,claw Applause
4p1_2mini_9.mp4,wipe down the stove on more time,
6p0_1mini_14.mp4,,leaves all the time you
6p0_1mini_14.mp4,,give them a quick rinse
6p0_1mini_14.mp4,,go off really quickly in a few days
6p0_1mini_14.mp4,adding the basil,
6p0_1mini_14.mp4,serve my stir-fry,
6p0_1mini_14.mp4,,do the buzzer all the spinach
6p0_1mini_14.mp4,add a little bit of extra flavor,
6p0_1mini_14.mp4,,leaves at the end
6p0_1mini_14.mp4,,add a handful of fresh baby spinach to stir-fry Laxus I
6p0_1mini_14.mp4,,keep a basil plant in my kitchen it
6p0_1mini_14.mp4,serving that onto a plate and because it,
6p0_1mini_14.mp4,,add the rats
6p0_1mini_14.mp4,,find when I
6p0_1mini_14.mp4,,muster fire as well these
6p0_1mini_14.mp4,,buy a little basil plant
6p0_1mini_14.mp4,adding some fresh basil,
6p0_1mini_14.mp4,,add them to my meal I also sometimes like when I
1p1_1mini_5.mp4,make it a little bit more stable,
1p1_1mini_5.mp4,putting some really light things on the shelving like a few towels,
1p1_1mini_5.mp4,,add some L brackets
1p1_1mini_5.mp4,,moving into a few different next we
1p1_1mini_5.mp4,fix on the hardware,
1p1_1mini_5.mp4,see there,
1p1_1mini_5.mp4,shelving there,
1p1_1mini_5.mp4,shelving I,
1p1_1mini_5.mp4,stayed pretty steady,
1p1_1mini_5.mp4,get some l-brackets just,
1p1_1mini_5.mp4,give it an even more secure finished product you,
1p1_1mini_5.mp4,keeping it pretty simple,
1p1_1mini_5.mp4,created that,
1p1_1mini_5.mp4,finish up,
1p1_1mini_5.mp4,,finish up the boys bathroom next we
1p1_1mini_5.mp4,,yeah it
4p0_8mini_11.mp4,list or link all of the products,
4p0_8mini_11.mp4,,see you again soon
4p0_8mini_11.mp4,,shown in the description box below for you
4p0_8mini_11.mp4,,check it
4p0_8mini_11.mp4,,thank you
4p0_8mini_11.mp4,,make sure that you
4p0_8mini_11.mp4,,give it a thumbs up if you
6p0_9mini_2.mp4,,use mixed berries if you
6p0_9mini_2.mp4,use one cup of frozen blueberries you,
6p0_9mini_2.mp4,add about half a cup of water,
6p0_9mini_2.mp4,,blend this movie up then I
6p0_9mini_2.mp4,,adds to the creaminess
6p0_9mini_2.mp4,,adds healthy protein to the smoothie
6p0_9mini_2.mp4,,add flavor
1p1_6mini_3.mp4,using my miter,
1p1_6mini_3.mp4,creating my measurements,
1p1_6mini_3.mp4,move the wood just a tiny bit over if I,
1p1_6mini_3.mp4,working with the miter,
1p1_6mini_3.mp4,,work with this
1p1_6mini_3.mp4,,fits really well
1p1_6mini_3.mp4,come down a little bit,
1p1_6mini_3.mp4,,make sure
1p1_6mini_3.mp4,,make sure if you
1p1_6mini_3.mp4,,marking I
1p1_6mini_3.mp4,met the mark,
1p1_6mini_3.mp4,,taking a pencil
1p1_6mini_3.mp4,,wearing goggles
1p1_6mini_3.mp4,,do that
1p1_6mini_3.mp4,,get as close to the pencil
1p1_6mini_3.mp4,get your wood cut for you that you,
1p1_6mini_3.mp4,,use once you
1p1_6mini_3.mp4,use my miter,
1p1_6mini_3.mp4,,saw the next thing that I
1p1_6mini_3.mp4,,marking as possible
1p1_6mini_3.mp4,,paying attention to
6p0_5mini_4.mp4,,makes it
6p0_5mini_4.mp4,make oatmeal,
6p0_5mini_4.mp4,,stretching my calories as far as possible
6p0_5mini_4.mp4,cook the oats for an extra few minutes,
6p0_5mini_4.mp4,,eat in a day
6p0_5mini_4.mp4,,making my breakfast as
6p0_5mini_4.mp4,cook half a cup of dry rolled oats with two cups of water instead of one,
6p0_5mini_4.mp4,,lose weight on a really hungry day
6p0_5mini_4.mp4,,do on a hungry day
6p0_5mini_4.mp4,,filling as possible when I
6p0_5mini_4.mp4,,filling as the old
6p0_5mini_4.mp4,,keeps me full throughout the morning
5p0_5mini_1.mp4,,cloves all stuff I usually
5p0_5mini_1.mp4,,talked about on my channel before it
5p0_5mini_1.mp4,,made hot oatmeal this time
